pid,ProductId,Post_Review,Platform,Rating,Date,Helpful,Label
506,B001ELL9X6,"I find it a very sweet idea. You music is great that light is pleasant & also the heart tones etc very soothing. However, as soon as you turn on the breathing it is going up and down the belly sooo loud that sleep is not really to be thought of",Flipcart,2,13-12-20,,0
507,B001ELL9X6,"I'm totally excited, looks very cute and a great fall fold of noise settings.",Amazon,5,02-12-20,,0
508,B001ELL9X6,"The otter is very nice and with its various functions (light, music, movements,...) very individually adaptable to the preferences of the baby. The volume is also very well adjustable. Only small disadvantage is the weight of the otter. Our rating: 4.4 stars.",Flipcart,4,27-12-20,,1
509,B001ELL9X6,Just sweet of the little otter,Amazon,5,15-08-22,2,1
510,B001ELL9X6,A super sweet otter with great functions. It doesn't just calm down babies!,Facebook,5,13-01-20,,1
511,B001ELL9X6,"The otter is really very sweet and plays everything super, but the mechanics is really loud,(which you can turn off), otherwise I find it really great to fall asleep.Nevertheless, a great gift for birth",Twitter,4,25-10-20,,1
513,B000UWSQT0,A great sleep aid. Really soft and fluffy. Easy to use and with great functions that are variable.,Instagram,5,15-07-20,,1
515,B000UWSQT0,"Beautiful baby toy. Beautiful music, very pleasant tone, great sound. Totally cute. Absolutely recommended.",Flipcart,5,24-06-20,,1
517,B000UWSQT0,We (family Otter) are pregnant and have received the little one very early from the grandmother.Sleep now already every evening with the baby otter on the belly. I am curious as it is when the baby is there.,Amazon,5,24-09-22,,1
519,B000UWSQT0,Totally great not too bright simply super every now and then it cracks a little but totally sweet. Was the 1 gift for Christmas for our baby.,Flipcart,2,17-02-20,,1
520,B000UWSQT0,"Just sweet, the music is so heavenly gentle, the transitions quite discreet. My little granddaughter loves this plush animal",Amazon,5,14-11-22,,0
521,B0041CKRJC,"The article is exactly as it's described, and it's a great gift to future parents.",Facebook,5,26-02-20,,1
524,B0041CKRJC,It has really been one of the best investments for the baby. So something beautiful and soothing. Even I fell asleep in it.,Twitter,5,26-12-20,,1
525,B0041CKRJC,"A very nice cuddle, cuddly toy and sleep aid. Unfortunately he makes after one because a strongly quenching noise, when one activates the breathing. The noise is so disturbing that we use the otter only without it. Very bad.",Instagram,3,28-11-22,,1
526,B0041CKRJC,We love the Otter. It's really great. I think it's best that the music runs for 30 minutes and not just 10 minutes for all similar things. The child can fall asleep with relaxed music.,Flipcart,4,08-02-21,,0
527,B0007NG568,"In itself great, highly recommended also for children who get the otter ""only after 8 months. Unfortunately, the otter had to exchange once, because the breathing function was defective after 10 days.",Amazon,4,27-01-21,,1
529,B0007NG568,Very to recommend fast shipping Top product at any time gladly again!!!!!,Flipcart,5,10-02-20,,1
530,B0007NG568,"Unfortunately, the otter is broken after one month. Matching 2 days after the return period expired. For the money it is more than disappointing.",Amazon,1,28-10-20,,1
532,B0007NG568,SUPER - it is madness - everything in the description - is fulfilled,Facebook,5,26-12-20,,0
535,B0007NG568,I bought the slumber otter for my grandmother in the old age home. The music box plays pleasant music and also helps old people to relax and come to rest. The slumber otter no longer leaves my grandmother from the side. Clear purchase recommendation!,Twitter,5,18-11-20,,1
537,B000VKYKTG,A great gift. Our little love him. I bought another replacement (for the crib). When she sees him her heart goes up. I can only recommend this sweet otter!!!,Instagram,5,04-12-20,,1
538,B000VKYKTG,Has got my niece for birth and her parents don't want to miss him anymore. Helps super the little one to fall asleep and become calm. Even with her parents,Flipcart,5,31-01-21,,1
539,B000VKYKTG,Did this otter buy for my nigre her baby but after 1 month it doesn't work anymore. Could I get a phone number from them if my niece can turn? Vileicht could she get a new otter for her baby lg Katharina,Amazon,3,12-02-20,,1
540,B000VKYKTG,"A great and reassuring support when falling asleep. My child loves her little ""Otti"".Unfortunately, you can notice the music box very clearly. A stronger padding would be an advantage here.Nevertheless, I don't want to do without it.",Flipcart,4,29-12-20,,0
541,B000VKYKTG,I'm missing the plastic part in the back!Do I really need it?,Amazon,5,07-09-20,,1
542,B000VKYKTG,"The otter is so cute. Didn't really read all the functions when ordering.When he arrived, I was back and forth.Maybe a little hard, but that doesn't stop it.I would order it again at any time.",Flipcart,5,13-12-20,,1
543,B000VKYKTG,"Very good workmanship, not too loud tones, many functions and washable",Amazon,5,05-01-20,,1
545,B000VKYKTG,"Super soft, no annoying sounds. The light goes out after 15 min., the noise after 30 min.",Facebook,5,25-02-21,,1
551,B000VKYKTG,I love this otter I love the melody My son always knows when the music starts: now is sleep time ,Twitter,4,27-01-21,,1
552,B000VKYKTG,"Cute otter, I found the breathing sounds a bit too loud, so I turned them off. Otherwise a nice music box.",Amazon,3,02-02-20,,1
553,B000VKYKTG,"In itself the toy is very good. However, after a month it started to spin. Sometimes it goes out after 10 seconds, sometimes the sounds change by themselves.Ging back. Too bad.",Instagram,2,23-01-20,,0
557,B000VKYKTG,"The otter has been a great gift. Very soft, not too loud music, well adjustable.",Flipcart,5,06-02-21,,0
558,B000VKYKTG,"The little girl who got this from me unpacked it and immediately cuddled with it! And every night before she screamed at night and since she has the otter, she even sleeps peacefully!",Amazon,5,23-02-21,,1
559,B000VKYKTG,Fast delivery Top quality likes to be back so it has to be,Flipcart,5,04-11-20,,1
560,B000VKYKTG,"Overall a great part! However, this ""breath button"" cracks sometimes in certain positions, which is annoying.",Amazon,4,07-03-20,,1
562,B000VKYKTG,Simply super a super buddy of our daughter:) Volume can set man Light can set man Simply super A daily ritual in going to bed Otti to eyes too,Facebook,5,13-02-20,,1
563,B000HDMUQ2,Is just great for our grandchild works perfectly,Twitter,5,17-11-20,,1
564,B000HDMUQ2,"We have already tried several, none has convinced as much as the incredibly sweet otter!!",Instagram,5,30-12-20,,1
567,B000HDMUQ2,This is the best toy you can have! My baby sleeps wonderfully calmly with the sweet otter. As a gift it is far more suitable than very good! Definitely recommended.,Flipcart,5,15-09-20,,1
568,B000HDMUQ2,The sweetest otter in the world :),Amazon,5,11-02-20,1,1
569,B000HDMUQ2,"I bought the otter for my little nephew. He didn't have a quiet night for weeks. The otter really calmed him down and let him fall asleep, no matter how much he resisted falling asleep.",Flipcart,5,26-11-20,,1
570,B000HDMUQ2,"The otter is fluffy and soothes very! Perfect to come down or fall asleep. Noise level is pleasant and the volume can be adjusted.It is also very suitable as a gift, so you can do nothing wrong!",Amazon,5,19-02-21,,1
572,B000HDMUQ2,"Unfortunately not so good, for the price.One easily gets to the inside lying mechanics, adjusts easily.There is still a lack of protection I would say. Also bad to close. Still capable of development. Too bad....",Facebook,2,06-03-21,,1
573,B000HDMUQ2,"You just have to love this otter!It doesn't look totally cute, it's also really soothing. Both the music, the glow on your stomach and the light belly move.Not only for babies for relaxation.",Twitter,5,26-09-20,,0
574,B000HDMUQ2,"Super nice, nicer sound and really very reassuring.",Instagram,5,01-10-20,,1
578,B000HDMUQ2,We find the otter super.Only the motor for the movements appears somewhat loud depending on the volume of the music.,Flipcart,5,22-10-20,,1
579,B000HDMUQ2,The little otter likes. It's a gift for the little newborn.,Amazon,5,03-11-20,,1
580,B000HDMUQ2,"Actually a super nice thing. Works well and has a soothing way. The mechanical noise of the breathing is a bit louder, but is still perfectly fine.Overall beautiful product!",Flipcart,4,28-01-21,,1
581,B000HDMUQ2,"the little one likes super, is very soft and cute, clear purchase recommendation",Amazon,5,04-01-21,,1
582,B000HDMUQ2,Very fast delivery and very good quality,Facebook,5,17-12-20,,1
583,B000HDMUQ2,The otter is really great. He does what e should. Helps my daughter fall asleep. Super is also the volume control. After 30 min he proceeds by himself.,Twitter,5,10-10-20,,1
587,B000HDMUQ2,Very sweet! Will be given away! Was also recommended to us.,Flipcart,5,21-11-20,,1
589,B000HDMUQ2,"I gave the otter to a friend for the birth of his twins. he was very touched and the little ones are going to go all the way. So for me an absolute hit the product, that's why top rating :-)",Amazon,5,04-01-21,,1
590,B000HDMUQ2,the recipient has not yet complained,Facebook,5,11-02-21,,1
592,B000HDMUQ2,"teur, I've already thrown it,The quality is not good",Twitter,1,02-01-20,,1
593,B000HDMUQ2,Was bought as a gift and arrived super.,Instagram,5,13-11-20,,0
594,B0041QIHC2,"You can control the volume, but even on very loud it is pleasant.The little one no longer sleeps without her otter! So perfect!",Flipcart,5,06-03-21,,1
595,B0041QIHC2,The slumber otter is really very sweet,Amazon,5,31-10-22,,1
599,B0041QIHC2,Top gift for the baby. Even the parents like,Flipcart,5,16-12-20,,1
600,B001ELL9XG,Super cute otter! Nice soft material the music is pleasant and later it can be used as a cuddly toy since you can take out the box! P.s. You can wash it!! Beautiful gift,Amazon,5,01-03-20,,1
601,B001ELL9XG,I bought the otter for my son as a sleep aid and since then it has been used every day. The light and the music seem soothing. The fabric does not feel as high-quality as hoped but otherwise we are completely satisfied.,Facebook,4,26-02-20,,1
602,B001ELL9XG,I was only skeptical if it really works but I've been trying the slumber otter for the first time so back and forth from,Twitter,5,15-10-20,,1
603,B002DXZI40,Purchased in May and broken in September,Instagram,1,11-08-20,,1
604,B000ER6YO0,You can adjust everything individually and it doesn't need much battery either.,Flipcart,5,02-01-20,,0
605,B000ER6YO0,"Have given these sweet otters to a friend, the joy was great. He is totally cuddly soft and washable, which is really important in contact with small children. I am enthusiastic about this cuddly animal and can totally recommend it.",Amazon,5,28-01-20,,1
606,B000ER6YO0,"Very adorable, our little one sleeps super",Flipcart,5,07-09-20,,1
607,B000ER6YO0,"In itself this is really a nice sleep aid, but already after a short time the Otter does not play 30 seconds at a time. For this the price is quite overpriced. Very sad!!! Unfortunately the return period at the time was already at the end.",Amazon,3,09-12-20,,1
608,B000ER6YO0,"So I'm very satisfied, like described, just recommended, with delivery has been a bit delayed, but otherwise everything is good,",Facebook,5,21-12-22,,0
610,B000ER6YO0,Very suitable for sleeping aid,Twitter,5,08-11-20,,1
613,B000ER6YO0,"I bought the slumber otter for a 5 year old. She loves the slumber otter totally and can't sleep without it anymore, as this one soothes her.",Instagram,5,25-01-21,,1
614,B000ER6YO0,"Absolute recommendation! For everyone to recommend, gave it to my sister's baby and he loves it! Sleeps super independently with the otter, even the two-year-old uses it every now and then! Great gift to freshly baked parents!",Flipcart,5,17-02-21,,1
615,B000ER6YO0,Fast deliveryA great gift for my granddaughter and for the parents,Amazon,5,31-07-20,,1
616,B000ER6YO0,Beautiful music box and pleasant melody. The constant raising of the music box is history. It has become a ritual that we turn on the otter while going to sleep. Would fetch it again.,Flipcart,5,19-11-22,,1
617,B000ER6YO0,Our son loves this clock. Especially beautiful are the different sounds. These can still be accompanied by breathing movements or light. Ideal for our sleep routine.,Amazon,5,13-01-20,,1
618,B000ER6YO0,"I am very satisfied, would be even better if it was still a sound quieter, but otherwise the otter is really recommended.",Flipcart,5,06-02-21,,1
619,B000ER6YO0,I gave it away is super arrived,Amazon,5,20-12-20,,1
621,B000ER6YO0,I bought it for my enkerl,Facebook,4,29-11-20,,1
622,B000ER6YO0,"The otter is great. The small light is calming, just like the breathing. However, the engine is a bit annoying.",Twitter,5,13-01-21,,1
623,B000ER6YO0,My twins love him so much that I needed 2 because they wanted to be in both...,Amazon,5,16-12-20,,1
624,B000ER6YO0,Good workmanship not too loud very robust,Instagram,5,06-12-20,,1
626,B000ER6YO0,"This cuddly toy is not only soft, but also calming. Due to the different sounds, babies and toddlers can relax easily.",Flipcart,5,27-12-20,,1
628,B000ER6YO0,"We use it only with the melody and it is great to fall asleep. The otter is nice cuddly and you can also wash it properly.Batteries hold, only with melody despite repeated nocturnal use, really long.",Amazon,5,21-03-20,,1
629,B000ER6YO0,"One of the best investments, our little mouse can relax and fall asleep with the otter",Flipcart,5,22-01-20,,1
630,B000ER6YO0,"Unfortunately, it wasn't accepted at all.The engine is also quite noisy.Unfortunately, I can't recommend it at all. But every baby is different.",Amazon,1,20-02-21,,1
631,B000ER6YO0,The only downside is that you have to open the Velcro fastener at the back to change something. A little loud when the child is already dunking,Facebook,5,10-12-20,,0
632,B000ER6YO0,"It's very cute, my baby (in the belly) loves it, and so do I!",Twitter,5,25-11-20,,1
636,B000ER6YO0,It's great with the baby.,Instagram,5,01-01-20,,1
638,B000ER6YO0,OBJECTIVELY a nice idea...But the mechatronics spins completely the abdominal movements are catastrophe it squeaks totally...Unfortunately I've destroyed the packaging already because I can't exchange it...,Flipcart,2,04-11-20,,1
639,B000ER6YO0,It's soooo incredibly sweet.tolles toys,Amazon,5,06-11-20,,0
640,B000ER6YO0,"Actually a nice music box. However, the engine is so loud that you have to make the melody very loud to hear it.",Flipcart,2,02-01-21,,1
641,B000ER6YO0,"Since our daughter has the little Otter to sleep with in bed, she seems much more satisfied and sleeps in a short time. We are really excited",Amazon,5,15-12-20,,0
642,B000ER6YO0,"Unfortunately, the engine is quite loud and clacked and the sound/noise is not convincing either. We had a different idea. It doesn't look as cute as expected.",Facebook,2,18-12-22,,1
643,B000ER6YO0,Perfectly just beautiful. Just the right thing. Helps my baby fall asleep again. Very cuddly and mega sweet,Twitter,5,06-07-20,1,0
645,B000ER6YO0,Super sweet and very pleasant to listen to.,Instagram,5,09-01-21,,1
649,B000ER6YO0,Super gift for babies and toddlers,Flipcart,5,02-03-21,,1
650,B000ER6YO0,"My son got him at 2 1/2 months and he sleeps great with him. In my opinion the engine while breathing could be quieter, but in no way seems to disturb my son",Amazon,5,12-01-20,,1
651,B000ER6YO0,The otter has many different functions and is very soothing for our baby. Helps us to fall asleep very well,Flipcart,5,04-07-20,,1
652,B000ER6YO0,After a few days already defective,Amazon,1,08-12-20,,1
653,B000ER6YO0,"Not only wonderful for the baby, but also very relaxing for future parents. I can recommend to anyone",Facebook,5,19-11-20,,0
654,B000ER6YO0,"Very nice Otter, my daughter fell asleep very well, but it was broken after a quarter of a year, so that the belly did not rise any more and the music was played only briefly.For the price very disappointing.",Twitter,2,02-07-20,,1
657,B000ER6YO0,Fine.. my grandson loves it,Instagram,5,05-03-20,,0
659,B000ER6YO0,"Actually, he is well thought out and the thought behind it really great. My daughter always fell asleep very quickly for music, we used him 3 months daily. Unfortunately, he is already broken!",Flipcart,3,09-12-20,,1
660,B000ER6YO0,Calming and cuddly. Very great music box.,Amazon,5,20-11-20,,0
662,B000ER6YO0,Therefore no feedback,Flipcart,5,20-01-21,,1
664,B000ER6YO0,"He is very sweet, yet a little loud to put him right next to a baby.",Amazon,4,21-08-20,,1
666,B000ER6YO0,The otter is much too loud with its mechanical noises and now after a little more than 1 month the drive from the belly is defective. It no longer drives out or enters.,Flipcart,1,17-11-20,,1
667,B000ER6YO0,Perfect gift,Amazon,5,14-02-21,,0
669,B000ER6YO0,My little one falls asleep so fast with the noise noise and this beautiful pulsating light soothes her very much.A toy where I can recommend further.,Facebook,5,23-02-21,,1
670,B000ER6YO0,"Sounds very mechanical and less real. Unfortunately, the gifted baby doesn't like the slumber otter so much.",Twitter,5,18-01-20,,1
672,B000ER6YO0,Highly recommended,Amazon,5,30-10-20,,1
673,B000ER6YO0,"Very very sweet cuddly animalUnfortunately, the movement of the belly is very loud and ‘rapples' somehow",Instagram,3,04-01-21,,1
674,B000ER6YO0,Great quality.,Flipcart,4,01-02-21,,0
675,B003KDCJYY,I gave the teddy and the baby as well as the mother is totally thrilled.It can't be done without it.I would give it away again and again.,Amazon,5,21-01-20,,1
677,B000MTIYF2,"THE delivery was very fast. The quality is very good, a nice toy and a great sleep aid",Flipcart,5,06-10-20,,1
679,B002E0RIHM,Mega the animal.. not so loud not so quiet has several musical sounds horny,Amazon,5,02-07-20,,1
683,B002E0RIHM,Sweet gift for birth!,Facebook,5,29-12-22,,1
684,B002E0RIHM,I gave it to a friend and she's absolutely thrilled.,Twitter,5,03-11-20,,1
686,B000S806VM,Our slumber otter is already broken after 6 weeks of use. Otherwise I find it really great!,Instagram,1,29-01-21,,1
687,B000S806VM,Very nice.,Flipcart,5,29-12-22,,0
688,B000S806VM,"Beautiful cuddly music box with very pleasant sounds. The only drawback: the music box lights up at the belly, where it is also switched on and off. My child grasps the light and the clock is already off.",Amazon,3,14-01-20,,1
689,B000S806VM,"Great toy, but something heavy",Flipcart,4,20-01-21,,0
691,B000S806VM,That's really sweet.,Amazon,5,09-11-20,,1
693,B000S806VM,"Not long in use, until now great. The only thing that could be changed is the clasp. I find Velcro very unfavorable, because you might wake up the baby again if you want to switch.",Facebook,4,07-10-20,,1
694,B000S806VM,"Very sweet cuddly seal, unfortunately a little difficult to operate as the Velcro fastener is exactly on the buttons of the remote control. Furthermore, the sound of the drive is too loud when the book is up and down.",Twitter,3,19-12-22,,1
695,B000S806VM,Everything's fine,Instagram,5,28-12-20,,0
696,B000S806VM,"I'm very satisfied, it's a cute music box easy to use so I can't make any criticism of it!!Would I buy again and again and also give away a really nice idea",Flipcart,5,20-10-20,,1
697,B000S806VM,As a gift or for one's own child. Even us parents have grown to the heart of the little one.,Amazon,5,09-01-21,,1
702,B000YT5DBS,My daughter loves him. In principle 5 stars worth if he only goes a trace even quieter. Otherwise wonderful clock. Absolutely recommended.,Flipcart,4,19-10-20,,1
703,B005NEXK6Y,Beautiful the little baby robe ---A beautiful gift for birth and also beautiful this breathing as the belly lifts.Comfortable light. Secure purchase recommendation.,Amazon,5,21-09-20,,1
706,B005NEXK6Y,"In itself it is a sweet cuddly toy/toy, but the price is too high!",Facebook,3,24-02-21,,1
708,B005NEXK6Y,Thank you again,Twitter,5,19-12-20,,0
709,B00448SNSA,Very fluffy and pleasant. Due to the light vibration very soothing for the child.,Instagram,5,05-02-21,,1
711,B0002XIB2Y,Very sweet.,Flipcart,5,25-02-21,,1
712,B0002XIB2Y,"The otter is basically very sweet and fluffy, but unfortunately the motor for the abdominal movement is very loud and thus extremely disturbing.",Amazon,3,04-11-20,,1
714,B0002XIB2Y,"Was for a friend, but her baby loves it when I'm ready, I want it for my baby too",Flipcart,5,15-01-21,,0
715,B0002XIB2Y,Pleasant sleep aid. Especially the night light is very soothing and the melodies have a nice sound.,Amazon,5,09-02-20,,1
716,B000F0G75W,"We like the music box very well. A star trigger, because the ""breath function"" is very loud.",Flipcart,4,18-01-20,,1
718,B001EQ4DVQ,Super gift,Amazon,5,09-11-20,,1
719,B001EQ4DVQ,Super sweet can be completely adjusted. Velcro closure is not to be opened by children. The slumber songs are also very pleasant.,Facebook,5,28-10-20,,1
721,B001EQ4DVQ,Super Sweet my granddaughter sleeps fantastically with the Otter and he is also positively rated by the parents.,Twitter,5,16-12-20,,1
723,B001EQ4DVQ,Very nice. Not too loud and very cuddly.,Amazon,5,13-02-20,,1
726,B001EQ4DVQ,Beautiful companion for the little ones. We mainly use the beautiful songs as a sleeping ritual and the snoring of the otter (mega sweet) you get tired of it yourself. ;),Instagram,5,09-09-20,,1
727,B001EQ4DVQ,A great cuddly animalHelps our twins fall asleep,Flipcart,5,15-01-21,,1
736,B001EQ4DVQ,"Only lasts 1.5 months, then the mechanism broke in the belly and it also no longer played music. One expects more for the money, especially a longer possibility of use.",Amazon,1,17-12-20,,1
737,B001EQ4DVQ,"Give the otter to friends when they become parents, everyone loves him!! Not artificial and cuddly",Flipcart,5,21-12-20,,0
738,B004DTNJU2,Very nice and useful article. Is worth the money.,Amazon,5,25-11-22,,1
739,B004DTNJU2,Our little one loves her otter so much that he belongs to the sleep ritual every evening.,Facebook,5,07-12-20,,1
740,B004DTNJU2,"Neutral smell, in itself great product, unfortunately it surrs a little.",Twitter,4,26-11-20,,1
742,B00473OV2E,"I love the slumber otter!Of course, my son too.There are different sounds.We always use the music and even I can relax as a mama.",Instagram,4,20-03-20,,1
744,B00473OV2E,"I bought the slumber otter in March and it doesn't work properly anymore, it stops after 5-10 seconds.",Flipcart,1,21-11-20,,1
747,B0048IACB2,"Great gift, feels very good, discreet light with pleasantly gentle music",Amazon,5,06-03-21,,0
748,B006F2NYI2,Music and sounds great. My grandson loves him.,Flipcart,5,30-11-20,,1
749,B006F2NYI2,"Very sweet, but you can really hear the noise from the engine, so a star trigger.",Amazon,4,05-11-22,1,1
750,B006F2NYI2,I was really surprised how real that breathing looks. I would buy it again,Facebook,5,28-02-20,,1
751,B006F2NYI2,"The sound does not sound quite natural, but our baby loves the otter. It is used both at day and at night.",Twitter,5,22-01-20,,1
753,B006F2NYI2,It is simply great. It helps the baby if they do not come to rest to fall asleep. Highly recommended. The automatic shutdown of 30 min is also good.,Instagram,5,14-10-20,,1
755,B006F2NYI2,Engine too loud,Flipcart,3,25-02-21,,1
756,B006F2NYI2,Every evening as ritual in use for almost 4 months. Whether it helps. Mhhh. I think so:),Amazon,5,26-02-20,,0
758,B006F2NYI2,Very good,Flipcart,5,11-11-20,,1
759,B006F2NYI2,Super cuddly toy biting fluffy at the beginning but that's all great,Amazon,5,15-12-22,,1
761,B006F2NYI2,"Looks very cute, nice music but unfortunately the engine is a bit noisy and rather annoying when falling asleep.",Facebook,3,08-08-20,,1
762,B006F2NYI2,"Great to give away, but also for you, even if you are pregnant and put it on your stomach in the evening.",Twitter,5,07-03-21,,0
763,B006F2NYI2,"Such a great music box, loudness can be super regulated like the other sounds. Unfortunately, the small engine slows down after a while.",Instagram,4,17-12-20,,1
767,B006F2NYI2,The video promises more than original... Totally disappointed....,Flipcart,1,02-01-20,,1
768,B004A8VV42,Article as expected. Just great.,Amazon,5,12-01-21,,0
769,B002XG21MO,The otter was a gift for my little grandson. So I can't judge; but I haven't heard anything negative from the parents yet.,Flipcart,5,13-10-20,,1
770,B002XG21MO,Very quickly and with great joy received!,Amazon,5,24-12-22,,1
771,B002XG21MO,That keeps hanging and then you can use the nixht more.For what it costs it is not good,Flipcart,1,09-12-20,,1
772,B002XG21MO,Super sweet and easy to use. The small sleeps great with it. Music plays about 30 min and is very soothing. Just recommended.,Amazon,5,23-06-20,,0
773,B002XG21MO,Our son loves the otter he always has to fall asleep,Facebook,5,13-12-20,,1
776,B002XG21MO,"All right, but it's a little too quiet for us.",Twitter,4,29-11-22,,1
778,B006GK4XVA,Was a gift and arrived great. Highly recommended.,Amazon,5,29-07-20,,1
779,B0049UVNYY,This stuffed animal is super sweet and there are already several friends for their children bought this stuffed animal. It is really recommended.,Instagram,5,11-01-21,,1
780,B0062KYM9C,"Product already bought twice. Both times broken, after only a short time. Songs are played only briefly.",Flipcart,1,28-02-21,,1
785,B0002MKFEM,Such a sweet part!,Amazon,5,22-12-20,,0
786,B0040TPNO0,very nice part recommended,Flipcart,5,23-09-20,,1
787,B0048IK8UC,My niece loves it.,Amazon,5,29-10-20,,1
788,B000LRG11O,My grandson loves it.,Facebook,5,29-11-20,,1
790,B001E6KBSK,Very sweet.,Twitter,5,19-10-20,,1
