pid,ProductId,Post_Review,Platform,Rating,Date,Helpful,Label
1532,B003YXWAF8,"My infant son won't sleep without me near. I wanted something that might help him fall asleep without me. This cute and soft otter is just what I was looking for. I love that this has the rising and falling chest feature. It's the perfect thing to make him feel like he's falling asleep with me. This also features soft, pleasant music or white noise or snoring. It's really nice that you can choose which option you prefer as well as have control over how loud or soft the sounds are. My only complaint is that all of the 'noise' options seem to last longer than just the simple rise and fall and I'd rather my son not get used to having sounds in order to fall asleep. That one complaint aside, I also love that this is machine washable when you pull the remote out of the back. And amazingly, I find my older kids enjoying sitting and holding this otter too.",Amazon,4,22-06-22,1,1
1533,B003YXWAF8," Fisher-Price's Good Night Luv Loubout is a super cute, super soft, super awesome little stuffed toy for babies!

Place the little otter in the crib next to your little one and press play. The little otter will lure your baby to sleep as its soft belly lifts and lowers in rhythm.

The otter also plays music and lights for up to 30 minutes.

Summary:
(1) Musical otter soother with ""breathing"" motion for babies
(2) engage your baby's senses of sight, hearing, and touch
(3) mimics the rhythmic motion of your breathing to naturally soothe your baby
(4) customizable up to 30 mins of music, sounds, and soft lights
(5) super soft fabrics
(6) machine-washable (with electronics removed)",Instagram,5,23-06-22,1,1
1534,B003YXWAF8,I was very surprised when we received this to see that the otter breathes just like it would in real life while it is playing music or one of the sounds that it plays.  My daughter loves sleeping with this in her pack n play and feeling it takes breaths and the music is the perfect volume so it isn't too loud or soft and it helps to soothe her to sleep.  It also has a little light in it's stomach which is great too because it is very soft and not meant to wake up your little one.  I am so very happy with this toy and so is my daughter.  Great item to have to help your little one sleep in their own safe space and still think that  someone is next to them.,Flipcart,5,05-07-22,1,1
1535,B003YXWAF8,"My LO LOVES this little otter. She cuddles up with it and squeezes it. She seems to be soothed by the sounds and the breathing motion. I was nervous she might have found this scary, because something things that move make her cry, but this guy didn't! My LO just turned a year, and I can foresee her using this for at least another year, if not longer!",Amazon,5,10-07-22,1,1
1536,B003YXWAF8,"This is a nice soothing sound machine/stuffed animal. There are buttons inside the back under the velcro. The options are for its ""breathing"" motion, a light on its tummy, music, or sound. After you make the selection you simply press its stomach and it will do them all, but for each a separate amount of time. It will do 30 minutes of music/ sounds, 10 minutes of breathing motion,  and 15 minutes of the light. The nice thing about this is the otter is machine washable, you just take the electronic unit out.",Flipcart,5,06-07-22,,1
1537,B000UXA3L8,"My first impression was that it didn't really look like the picture and that something looked wrong with it.  When it started breathing, that was all I needed.  It's just too creepy for me.  The kids don't seem to care, but it's not something I would pick up and say ""cute"".",Amazon,3,19-06-22,2,1
1538,B000UXA3L8,"I just might have slept with it (since my husband doesn’t allow live pets in our bed). But she loves it and I’m teaching her that she can only have it at bedtime. That way she has something she loves to help her sleep. And help her it does! When she’s tired, all it takes is about five minutes of her listening or feeling the otter breathe and she’s asleep. This comes highly recommended!",Facebook,5,22-06-22,1,0
1539,B004AVYUOW,"My LO has had trouble sleeping in his own crip since he was born , I never thought I would be able to transition him easily . However this otter is the perfect transitioning tool . He watched his belly move up and down as he falls asleep and stays asleep all night . I highly recommend this !",Twitter,5,29-07-22,,1
1540,B001ESOQAM,Oh my this is simply adorable.  It simulates soft noises like baby would hear in the womb.  The animal breathes deeply and his tummy rises and falls while he’s deep asleep and you hear the sweet noises.  Soothes baby.  Wonderful shower present.,Instagram,5,14-07-22,,1
1541,B001ESOQAM,"Although this was larger than expected, this little snuggle buddy is amazing!! This soothes my baby so well. The belly “breathing” is amazingly soothing for my newborn. I will be buying one for my niece who is due next moth. This will make an excellent shower gift.",Flipcart,5,25-07-22,,1
1542,B001ESOQAM,"So many options.  Otter helps baby sleep with a breathing option.  Never seen anything like it.  Helps work on natural senses of touch, sound, and sight.  Very soft material.  Very cool for modern parents.",Amazon,5,28-08-22,,1
1543,B001ESOQAM,This is so sweet and my baby absolutely loves it. Really happy with this.,Flipcart,5,02-07-22,1,1
1546,B001ESOQA2,Very sweet and soft,Amazon,5,06-03-20,,1
75,B003XT4AV0,"It is a very practical toy, my baby is almost three months old and it is ideal for you not to feel alone in the crib when we lay her down.The stick that it has is that it lasts half an hour and that to change from melody to sounds you have to open a Velcro that is in the back and that makes a lot of noise and the baby wakes up.",Facebook,3,26-12-22,35,1
91,B003XT4AV0,This perfect works great and my baby loves it.,Twitter,5,13-08-22,15,0
93,B001FA1MCO,"Above all I liked how smooth it is and the fact that it can be separated from the washing device (unbelievable error but today there are still toys for babies that cannot be washed...) so a great point in their favor, and more in the situation we are living... (you fall in the street and if you can not wash maybe you think until you throw it away... :-SThe device is like a controller (you can see it in the photos), you have options for almost everything! A pity is true, I have read in other comments that asked to record the voice and no, it does not include that option, although for my part I do not consider it essential.In general I am very happy with the otter, the only defect I see it is that the babies take everything to the face and the Velcro that closes the back is very rough and rigid, I think that another type of Velcro or a zipper would have been better option. Still I recommend it, I am sure that even if it stops working, it will remain one of their favorite stuffed animals :)",Instagram,5,16-10-20,4,1
96,B001FA1MCO,"It turns on by pressing the belly, but to turn it off you have to open the Velcro from behind and press two buttons at the same time, which is somewhat uncomfortable.Although if you press the gut it also ends up turning off, but in the instructions indicate that the way to turn it off is in the back buttons, so I don't know if it will spoil it in the gut.The movement of the breath makes quite noise.However, the doll is very sweet and with the light low or off it is very relaxing.The sounds are very good and you can regulate the volume.",Flipcart,4,05-12-22,5,1
97,B001ELL6O8,"Spectacular! Our baby of almost 8 months, who has always had a hard time falling asleep, loves and relaxes so much!!! The sound of breathing is the one we like the most, along with the light and movement of tummy. It has become an essential for the time to go to sleep!",Amazon,5,27-07-22,7,1
98,B001ELL6O8,"We bought it for our 4-month-old baby, who has a hard time falling asleep, and we only get him to do it on the chest in bed, and the truth is that he has not listened to it, nor does it happen to sleep, nor to play, it strikes him zero. The toy itself meets all the features it announces, it is adorable, warm and soft, but in our case, it does not fulfill its purpose of relaxing and sleeping the baby.",Flipcart,3,26-11-22,6,1
103,B001ELL6O8,"My daughter is delighted and at last it seems that we get her to sleep alone with her otter friend! She is two years old.The teddy is very soft, the musics are nice and in a short tone, perfect to help relax (to me relax, hahahaha).She has a light also soft, that is enough to not stay in the dark, but she doesn't see much to get out of bed.The tummy makes a move to go up and down that definitely hypnotizes and that also helps her relax!It has been a successful purchase!At first it seemed a little expensive, but we like it very much and, the main thing, is helping the little girl fall asleep alone! :)",Amazon,5,13-07-20,2,0
110,B001ELL6O8,The best gift we could give our baby. Until three months he suffered from colic and has been his cot to date. He sleeps caressing him. At night we put the melody together with The Light of the tripita that goes up and down and sometimes the function of the heartbeat I think it will be his teddy for years.Like everything is improveable; the manufacturer would suggest that the engine (inside the teddy) of all functions be reduced and so the teddy was soft and manageable. I fear that as soon as the baby grows and can manipulate it we will have to remove it because it is very heavy and in that case we will fill it with foam but our BEBE is FELIZ with its otter so highly recommended as a gift,Facebook,5,30-03-20,2,1
131,B001ELL6O8,"It is beautiful, soft and original, with the tummy that lights up and goes up and down as if breathing. It has 2 sounds (the typical music and the one that mimics the heartbeat and the breath) and has a very nice packaging to give away, besides it washes very well...",Twitter,5,01-11-22,3,1
142,B001ELL6O8,"For my Fisher Price is a brand of absolute confidence. Its products are safe for children, my children have never managed to disarm any; they also last for many years with their functions and appearance intact.And also they are fun and entertaining for children.For those reasons I chose this toy as a gift for my granddaughter.It is also a cute teddy, better than what comes out in the photo.I don't put 5 stars because it hasn't given me time to check its durability.I hope the brand hasn't lowered its quality, like many other brands and we continue to enjoy its quality.",Instagram,4,16-05-20,1,1
147,B001ELL6O8,My daughter loves the noise of the heart beating and stays fried,Flipcart,5,11-07-22,5,1
154,B001ELL6O8,"The product is good for my son who is not even two months old, it usually costs him to sleep and I thought about this stuffed animal, because it has colic and with the sound of the heart it falls asleep. Since it must remind him when it was inside me and with the music it relaxes. The only drawback is that to change it you have to open it and it makes noise I leave it open so you don't have to move it much. Otherwise it is fine, he still doesn't realize what it is but I hope that then he plays with it.Now that I have tried it a few days the batteries don't last anything...",Amazon,5,08-12-20,,1
162,B001ELL6O8,"It costs my little one a lot to fall asleep and I bought it to try, something else.The sounds are great and they are heard very well.The light is enough to not bother.The only stick that would put it is that, the sound of the belly mechanism is heard a lot at night. Otherwise, my daughter sleeps looking up and down the belly with the light on. It is relaxing.",Flipcart,4,10-02-21,,1
178,B006CGURWM,"The product came to me defective, the music stopped in a few seconds. I talked to the seller and did the replacement at the moment. I recommend the product, since I have a baby that resists to sleep and with this otter relaxes, between the relaxing songs that it brings and the breath that it simulates. I recommend the seller, has responded very quickly.",Amazon,5,23-05-20,,1
190,B00250I0EG,"It is a toy that we want to use since it is a baby, because the songs are very tender and sweet, it also has choice of heart beats or sounds from inside the utero. It is pleasant to the touch, but the apparatus inside is very large if it is not covered enough to be very soft.",Flipcart,4,17-10-20,,1
213,B000C21OOM,"Great product.It has a super touch aroused and my 5-month-old baby loves it and helps him sleep.It has relaxing sounds, different melodies, a dim light and the belly moves it providing you with the peace of mind you need to sleep.The bad thing is that to change the sound you have to open the Velcro and select it by hand, which makes it a little cumbersome.For my baby and for us 5 stars.",Amazon,5,02-11-20,,1
217,B003D4O92K,It’s great! We love it! It’s great that I have so many different sounds! My daughter sleeps right away with the nannyes and touching her belly! It’s been a good idea to buy it!,Facebook,5,27-09-22,2,1
218,B003D4O92K,"Get our baby not to cry at bedtime, the first day he cried a little alone and now nothing, it seems that when he sees it he already relaxes. He can put the music quite low and lasts 30 minutes, for now it is enough time for him to fall asleep and not wake up at the end. The movement of the belly makes quite noise but does not seem to bother him",Twitter,4,29-10-20,,1
226,B001IZM8A6,I liked it very much. It has several options if you want to put them together or separately.My son liked it very much for saying something bad has a very large sailboat behind and if you want to open it to change any option can the baby wake up,Amazon,5,25-12-20,,1
230,B001IZM8A6,"Ideal gift for parents who have recently had a Peque. Touch is incredibly soft and its sound, movement and light help (at least in my case) to fall asleep when the baby wakes up at night; especially useful from the age of 4 months, when (in some cases, like mine) there is a change in the baby's sleep pattern.",Instagram,5,27-12-20,,1
233,B0089PI9OC,Good quality. It works perfectly.awaiting to try it with the baby.super soft,Flipcart,5,02-08-22,2,1
234,B00061KYVI,"The Fisher-Price - Otter Sleeping Time, Baby Baby Baby Nut Toy and Hairy Newborn (Mattel FXC66) is great, very soft, teddy friendly, that allows to make movements and sounds. Easy to use. I do not give 5 stars for the rough and noisy Velcro, if you want to access the inside of the teddy. Otherwise it is perfect.",Amazon,4,05-09-20,,1
236,B00061KYVI,"The otter is soft, it breathes, it imitates the sound of the beating of the heart, it has music and light. All this with self-turning off. It worked perfect for two days to sleep our daughter but no longer works, although it is not the fault of the product.",Flipcart,5,28-12-20,,1
241,B00061KYVI,"My son loves it, he's his super friend comes with us everywhere, you can regulate the volume that at night doesn't hear you the whole neighborhood I'm sure that will help us a lot in the transit from the crib to the big one.",Amazon,5,18-11-20,,1
253,B003XV5LHK,"I don't give you the 5 stars because of the weight and sound the system makes when ""breathing"", otherwise I have to say that my baby relaxes very much with breathing and music, the light brings warmth to the softness of the otter that is beautiful.",Facebook,4,22-01-21,,1
275,B005WU7V00,"Doll to accompany the baby. Very soft, with choice of music, white or breathing noise. Light and movement included. The mechanism is removed very easily for an adult, allowing it to be washed or even used as a teddy simply.",Twitter,4,14-05-20,,1
289,B005CFC9XY,"Since I saw this little hair I fell in love. Our baby has not yet been born, but I am sure he will love it as it has many sounds, including that of the mother's womb, heart...Very good quality. It can be washed without problem by removing the mechanism inside.",Instagram,5,09-02-21,,1
290,B000SEJ842,Purchased for baby gift. Quality in materials and can cause instant sleep in adults. The girl has not yet given me her feedback but everything indicates that she liked it. Good purchase.,Flipcart,5,09-08-20,,1
291,B004X8TK8I,"Well this purchase now looks good, the doll inflates and deflates and my son thinks that we are the ones lying next to him. It works, good idea for children who just want arms",Amazon,5,17-12-20,,1
308,B004X8TK8I,"It's for a gift and I haven't used it with the baby yet, but I turned it on and the movement simulates breathing pretty well, if it works for me to hold more in the cradle I'll comment.",Flipcart,5,09-12-20,,1
316,B004X8TK8I,"It's beautiful, super cute.",Amazon,5,22-08-22,2,1
323,B004X8TK8I,"We give it to some friends who have had a baby, specifically it is 4 months old. Since we gave it to them you can not separate from it, especially to sleep, emit sounds that relax you very much and you fall asleep right away!",Facebook,5,02-08-20,,1
329,B000G6RYNE,"The breath that he does is the most and with the relaxing music... Look that I put things to my baby of a month and nothing calms him, it has been to put the teddy near the body and calms and stays until asleep. I love it.",Twitter,5,25-12-20,,1
337,B000G6RYNE,"My baby has loved it, the music relaxes him a lot, although personally the light seems excessive to me. Breathing makes a little noise, but soon only the music sounds.",Instagram,4,05-02-20,,1
356,B000G6RYNE,Magnificent. There are many musical stuffed animals to accompany the babies in the dream.But like this otter.. None! ideal the heart beat option.It has many options and being able to moderate the donation is very comfortable depends the moment relax or sleep of the baby.,Flipcart,5,21-01-21,,1
367,B000G6RYNE,Fulfill what he says even though our baby doesn't pay much attention to him doesn't have two months yet.Let's hope that in a few weeks they won't part!,Amazon,5,19-10-20,,1
368,B000G6RYNE,"A suitable game for babies of a few months, siave and with warm melodies for the baby to relax and sleep. I love that it is an otter and imitation of breathing. The best, that can be washed.",Flipcart,5,27-02-21,,1
378,B000G6RYNE,"Very heavy for a baby, the use is for older over 4 months or more, but clear for that age it no longer serves the nanny and the sounds it has",Amazon,3,18-09-20,,1
390,B000G6RYNE,Very soft. I thought I wouldn’t listen to the baby until after a few months but caught his attention from the beginning.,Facebook,5,19-02-21,,0
396,B000G6RYNE,"Since the first day my baby has loved this toy, all of it. Music, heart beat, breathing etc.. everything relaxes him, and gets him to fall asleep almost immediately, when before it cost me a lot. I certainly recommend it.",Twitter,5,28-10-22,,1
401,B000G6RYNE,"I bought it to give away. I didn't know that buying the newborn and the truth was right, because the child had everything, and this has loved the parents and the baby.",Instagram,5,03-01-20,,1
410,B000G6RYNE,"My baby really likes it, relaxes it. The only thing I don’t like is that it has to be opened to change the way. But I’d still buy it again. Very good toy for a baby.",Flipcart,5,28-12-20,1,1
414,B000G6RYNE,I loved the product the sound of the mother's belly heart enchants with the very appropriate product to relax your baby.,Amazon,5,09-12-20,,1
421,B000G6RYNE,"I bought it as a gift for my nephew, it is incredible. It has a very soft touch, breathes and with that it calms the baby very much. It does not weigh just very light and can be given to the baby since birth.",Flipcart,5,18-12-20,,1
429,B000G6RYNE,They gave it to me when my baby was born and now I've bought it for a friend I like very much and relax the baby,Amazon,5,15-10-20,,1
440,B000G6RYNE,"A wonder my baby falls asleep in a matter of minutes with her, has several ways to adapt to every moment, breathing mode is a pass since it relaxes us so much that even we fall asleep hahahaja I think it is an essential purchase.",Flipcart,5,07-07-20,,1
441,B000G6RYNE,"To change the way you have to disassemble it, take off... Etc with what it entails that the girl wakes up",Amazon,1,20-11-20,,1
442,B000G6RYNE,Great is a gift and it's a soft and sweet teddy I think you'll have a great time with him.,Facebook,5,23-12-20,,0
444,B000G6RYNE,"I love, very soft, very good quality and beautiful music and sounds.",Twitter,5,31-10-22,2,1
448,B000G6RYNE,"I was totally speechless, it's more than I expected.I repeated shopping to give away again.",Amazon,5,21-12-20,,1
450,B000G6RYNE,"This great. It has several musical sounds, mimics human breathing both in motion and sound and relaxes the baby. It is super soft and very nice. We are delighted with it.",Instagram,5,19-09-20,,1
459,B000G6RYNE,Great gift! Very good quality and attractive for the baby!. A great conpra,Flipcart,5,04-09-20,,1
467,B000G6RYNE,"It's great, and it does a function that of course for the little ones is very good.",Amazon,5,24-12-20,,1
469,B000G6RYNE,"I loved it and it has been very useful to sleep my baby but it has lasted 20 days to spoil, it no longer breathes and the sounds stop at the very beginning.",Flipcart,2,29-09-20,,1
488,B000G6RYNE,"I use it to help my 3-month-old baby sleep and he likes to put his little head together to that of the otter and I put the sound of heart and helps him sleep.I like it a lot, you can remove all the hair lining to wash it.",Amazon,5,10-02-21,,0
496,B000G6RYNE,I like that you can program it the music and for the baby the breath and it relaxes him very much,Facebook,5,23-07-20,,1
501,B000G6RYNE,"It's beautiful and we love it, the bad thing is that the pile ends right away.",Twitter,3,07-02-20,,1
505,B000G6RYNE,Very nice doll for newborns and children not so young.,Instagram,4,03-03-21,,0
514,B000G6RYNE,Very nice but has hard parts for a baby,Flipcart,4,27-10-22,1,1
522,B000G6RYNE,Product in perfect condition. To change so you have to open the back and it is a bit cumbersome. Soft touch.,Amazon,4,28-12-22,,1
528,B000G6RYNE,Very soft and recommended for babies relaxes the heartbeat a lot,Flipcart,5,22-09-22,1,1
531,B000G6RYNE,"It is a beautiful!!! It is large, tender and programmableIt can be washed",Amazon,5,01-12-22,,1
533,B000G6RYNE,"My baby loves it, and the sounds of the heart along with the breath relax him very much, it is to put him next to and sleep. It seems to me a great purchase and I arrive even before the scheduled date.",Facebook,5,01-11-22,,1
544,B000G6RYNE,Of course it is worth this product for everything as a whole.,Twitter,5,01-03-21,,1
556,B000G6RYNE,"spectacular, we are delighted. several sounds and lights. very nice.",Instagram,5,30-01-20,,1
561,B000G6RYNE,"For my little one it is IMPRESCINDIBLE to have him next to sleep, he does not forgive it. It is so so that we have to buy another to wash one and have the other in use. Super soft to the touch. A 10",Flipcart,5,21-10-20,,1
586,B000G6RYNE,The baby will love it when it's born.,Amazon,5,26-12-22,,1
588,B000G6RYNE,"It's a cuckoo, the girl loves it.",Flipcart,5,28-11-20,,1
609,B000G6RYNE,"Very soft and beautiful, my daughter loves to sleep above all.",Amazon,5,21-07-20,,1
611,B000G6RYNE,"At the moment, I liked everything.",Facebook,5,25-01-20,,1
612,B000G6RYNE,It was for a gift and they loved it.,Twitter,5,15-08-20,,1
627,B000G6RYNE,"A gift for my sleepy nephew, the sleeping baby and his parents delighted to see him sleep.",Flipcart,5,08-01-21,,1
648,B000G6RYNE,It was a gift and very well.,Amazon,5,29-10-20,,1
663,B000G6RYNE,Good for children of a certain age,Facebook,5,31-05-20,,1
665,B000G6RYNE,"It has made me very excited for my boy who is coming on his way, super soft, melodies that I sleep until I sleep I hope he likes it the same.I recommend it.",Twitter,5,15-10-20,,1
678,B000G6RYNE,Ideal for giftgiving,Instagram,5,25-12-20,,1
682,B000G6RYNE,"You accompany my grandson to sleep, it helps him, pity it only lasts 1/2 hr",Flipcart,4,31-12-20,,1
685,B000G6RYNE,Soft and with the features that the ad reflects. Recommended 100%,Amazon,5,07-02-21,,1
699,B000G6RYNE,Good product even though my daughter doesn't listen to him.,Flipcart,4,09-01-21,,1
704,B000G6RYNE,"It works pretty well to sleep my bb, it relaxes a lot, besides q has variety of sounds. The best is q you can regulate the volume. I recommend it",Amazon,5,21-11-22,,1
710,B000G6RYNE,An ideal teddy for babies to sleep on. It has several songs and sounds of the mother’s belly. My newborn likes it.,Facebook,5,14-12-20,,1
722,B000G6RYNE,His movement and the teddy breath,Twitter,5,10-07-20,,1
729,B000G6RYNE,"My daughter doesn't even marry him. I thought I'd help her sleep, but she doesn't like it.",Instagram,3,16-08-22,1,1
730,B000G6RYNE,It is very nice gift to give to any baby. It is very nice and adorable.,Flipcart,5,18-12-20,,0
735,B000G6RYNE,Charming soft,Amazon,5,07-12-22,,1
746,B000G6RYNE,Well nothing shrill with smooth movement my boy liked it,Flipcart,4,04-01-21,,1
766,B000G6RYNE,"For now my little 4 months seems to like it, it's very soft, the only bad thing is that to change sound you have to open it.",Amazon,4,09-02-21,,1
774,B000G6RYNE,"For a friend of work who has been a father and likes me a lot. Good quality and brand. Expensive, but worth it.",Facebook,5,07-03-21,,1
784,B000G6RYNE,My niece is delighted.,Twitter,5,20-12-22,,1
789,B000G6RYNE,"It has the appropriate size and is very soft for babies, it relaxes the sounds a lot and sleeps hugging it. We are happy with the purchase.",Instagram,5,02-12-20,,1
791,B000G6RYNE,"It's a real pass, it swells up the belly and vibrates with a soft song... I love it.",Flipcart,5,11-10-20,,1
809,B000G6RYNE,I like it very much.,Amazon,4,05-12-22,,1
815,B000G6RYNE,Very cool!,Flipcart,5,12-10-22,,1
824,B000G6RYNE,Super soft for a baby,Amazon,5,02-12-20,,1
