pid,ProductId,Post_Review,Platform,Rating,Date,Helpful,Label
152,B000G6RYNE,"Sweet otter, which is still nice and cuddly even after washing. The functions are varied and can be adjusted accordingly. The light is a great night light - not too bright. The melody can be regulated in the volume and thus also great to fall asleep. However, I personally find the breathing simulation quite loud and the ""motor"" which lifts the otter breast and lowers very prominently. But you can also simply switch off. With the control unit the otter is quite heavy - without but perfect for babies.",Amazon,4,01-01-21,,0
153,B000G6RYNE,"Unfortunately, the otter doesn't work right from the start. We slurped it in and after 2 minutes at the latest it is out without any touch. The lifting and senk movement when it works short is extremely loud can't imagine that it should be that way.Unfortunately I'm very disappointed because we were so happy to have found something for our little one at last and then it just doesn't work right.In itself it would be a super great gift or a great companion for the little ones in the evening but just for that it would have to work",Facebook,3,13-12-22,,1
156,B000G6RYNE,"The Otter is a very nice sleeping aid. The music is very pleasant, for my feeling much more relaxing than with similar articles. The following things are striking: - The buttons for switching on are behind a Velcro fastener. When you open this one is very loud. Very sad that there is no other solution here (zip, remote control). - The music runs only 30 minutes, which I feel as something short. If you want to turn on the music again, it is very loud as described above. Here would be a timer of advantage, which you can set yourself. - The motor for the abdominal movements is a bit loud. With sensitive children this can certainly also be very annoying. If you don't mind these aspects, you will find a great sleeping aid for your child here!",Twitter,4,15-10-20,,0
157,B000G6RYNE,"We took him out of the box and closed him right into our heart! Everything went very quickly. As usual Amazon delivered quickly, we packed the little otter, quickly put the batteries in and off it went :-) My daughter ( 1 1/2 years) closed him right into the heart - and my wife and I too! Now the little one, called ""Otter"" by all of us, is simply a part of the family! Sounds, music and the glow of his heart can be controlled well by an integrated control unit, This is well integrated into the otter, so that the little one can't take you out so quickly. The batteries keep with us for several months during daily use. The otter is washable according to the instructions and is very soft and pleasant. We feel the music is beautiful and soothing. If, my daughter and I, want to make a midday sleep, our otter is always with us. Our daughter loves him and we don't give him any more. That's my opinion of one of the best inventions for which we can not fall asleep well, want to relax and make a beautiful baby's sleep for all our children and make it a lovely baby's sleep.",Instagram,5,17-02-21,,1
159,B000G6RYNE,"The first impression is that the little face looks a bit cheaper than expected. But the breathing function and the light are really nice and you don't find anywhere else. The motor for the movement is a bit loud but due to its monotony will have a similar calming effect as the rest of the sounds. The music/noise are all pleasant and the operation easy. Conclusion: for home sweet, I wouldn't give it away rather because it doesn't look very good",Flipcart,5,06-11-20,,1
160,B000G6RYNE,"Very nice music box. It looks like on the picture. I don't know if the batteries were there anymore. I find it very sweet, also from the volume I find it good. Even my son who was at the time 3 years old thought it was great and wanted to have one too. I can recommend this otter very much because it is exactly as described.",Amazon,5,22-05-20,1,1
161,B000G6RYNE,"A great gadget even in pregnancy. I like to put the otters on my stomach and the small belly dweller reacts to the melody. He has some melodies and also a noise or sweet snoring on offer. I find handling a bit more difficult, because you have to open your back to change volume or mode. Nevertheless a nice companion and I am happy when our baby is in the world. Fast shipping, get on primeday cheaper.",Flipcart,5,14-11-20,,1
163,B000G6RYNE,"I was only skeptical, because my daughter only fell asleep for 12 months while still and cuddly animals hardly pays attention. Thought also that the light could rather disturb than help when falling asleep. Well, I was taught a better one! At Christmas I gave it away, we had nothing to lose and now it has become a ritual to turn on the otter in the evening and the light is pleasantly soft, warm and becomes in the rhythm of the breath brighter and darker. The breathing noise hears it most. Simply hammer!!! ***** Selection of melodies is top, volume control top quality top and batteries were also present. The only thing you CAN complain about: For example, if you want to switch from the breathing noise to music you have to do this manually, i.e. the Velcro closure at the back (sticks bomb-proof, because good quality) and then open and close again. However, it is still great, because you can wash the otter also after the inner life has been removed. But if you listen to the same thing as we do every evening, you simply press the belly and the otter is on or turn off again ;",Amazon,5,10-01-20,,1
164,B000G6RYNE,"Very cute look and works well but I would have liked to have a little more cuddly character. Due to the noise module, the otter is quite heavy, even for adults...my daughter therefore always needs help if she wants to wear it. In addition, I find it a bit worrying especially with small children that the noise module is very easy to access (only by Velcro ""protected"")...would have wanted me more child safety",Facebook,3,22-04-20,,1
165,B000G6RYNE,"The slumber otter was bought as a gift for a baby party. The parents were very happy about this unique gift. We are also glad that we did not decide for one of the many Pinterest ideas (windling places etc.), because this was too high. We have still decorated the otter with sweets and a congratulations card for quiet evenings/nights. For all those who also need a gift they should access here.",Twitter,5,06-10-20,,0
167,B000G6RYNE,"The slumber otter is actually a nice product. The sounds as well as the ""breathing"" of the animal are soothing and the music is wonderful. I was really excited about the otter that I bought as a gift for a newborn. Unfortunately, after barely two weeks of use, he already had a defect, because the music and the breathing movement did not work properly anymore. Amazon quickly made a remedy and so I was able to exchange the product for the friends I had given it to. Unfortunately, the second product after not even two months of use also shows the error, which is very sad and leads to the fact that I will not give the otter any more. :/",Instagram,2,11-02-21,1,1
168,B000G6RYNE,"So our little one calms down very well with Otti, at first she didn't fall asleep but was distracted almost the whole time or inspected him more closely. Meanwhile she also falls asleep with him and keeps her hand on the moving belly between time and time again.Can Otti only recommend :)Of course the motor is a bit clunky but doesn't really bother. The engine is running very quietly so far despite frequent use. All in one was a good investment",Flipcart,5,25-07-20,,0
169,B000G6RYNE,"Our 2 month old son loves the otter. He plays different melodies, snorting and breathing sounds, heartbeat as well as white noise. In addition, the belly cover moves and shines - which can be switched off or switched on. Especially the white noise is very popular here in case of restlessness or to fall asleep.The volume can be regulated wonderfully and is absolutely sufficient. The electronics can be easily removed to clean the otter. Besides, the otter is also really cute to look at. We would definitely buy it again.",Amazon,5,20-01-21,,1
170,B000G6RYNE,"Actually a nice idea, the functions are very nice and reassuring. Our daughter 15 months found him great.Now the big hook comes: he does not work any more after a short time, always goes off on his own and can then no longer be switched on.He was returned and ordered elsewhere, but also the second one there was the same problem. Also this was returned and we don't want any more. Battery change (supplied batteries are probably only intended for demo purposes in the shop) helped nothing at all.",Flipcart,1,08-02-20,1,1
171,B000G6RYNE,"Like myself, the otter was given for our still unborn daughter, but I always put it on her stomach and play the music before her, that's great about it that I can regulate the volume and the whole thing is finished after 30 minutes by itself.To this there are several functions of noises etc., which certainly have a very relaxing effect for a baby.I am very excited about him and he seems very reassuring.My niece (3) was so excited about this when visiting that the aunt did not miss it, to fulfill her desire for her own otter at Christmas and this is no longer to think away from her. She only sleeps with him!",Amazon,5,31-01-21,,0
173,B000G6RYNE,"I find it a bit hard to cuddle through the engine in the abdomen. But the fur and the head are very soft and cuddly. I find the engine quite loud. What makes our little ones scare up is the Velcro clasp on the back of the otter. This one must always open to press the buttons, quite loud. A small zipper or push buttons would be better here.Everything in all, however, the otter is cute, plays sleepy songs, mimics heartbeat, breathing and noise.",Facebook,4,05-01-21,,1
174,B000G6RYNE,"Super sweet sleeping aid for babies, pleasant melody and the light and the sound of the heartbeat is very soothing. Much better than a music box. Especially since it goes out on its own after about 30 minutes. Perfect!After half a year there were problems and the otters didn't work anymore. Got free replacement, so everything perfect! Didn't even have to send it back. Nice seller. Would I buy again and again.",Twitter,5,31-10-20,,1
175,B000G6RYNE,The slumber otter was from Grandma and Grandpa a Christmas gift to our sonloudness is absolutely ok for babies to fall asleep and also the different modis leave no wish open and keep the offspring in moodThe size of the otter is also absolutely sufficient for a baby and also really cuddly is the otter.Definitely recommended as the first sleep cuddly help :),Instagram,5,06-01-21,,1
176,B000G6RYNE,"Basically a good product only unfortunately not thought to end. The otter lies with in the bed and seduces to cuddle only unfortunately the otter together with the inside lying operating unit is very hard and heavy and when breathing it crawls. Furthermore, this super nice shell on the belly so interesting to press around that is played rather instead of sleeping. In addition, everyone who has a relative skillful child notices that it also has the Velcro closure open within a very short time and presses around on the control unit.",Flipcart,3,14-11-22,1,1
177,B000G6RYNE,"To the Otter: Super sweet cuddly toy, the belly is the on/off switch, individually you can also adjust volume, music, heart tone, abdominal movement and light at the back of the device. The device can be taken from the otter, so it can also be washed. For me a very clear purchase recommendation, certainly also arrives very well as a gift for freshly baked parents! I would have been very happy about it.",Amazon,5,05-11-20,,0
179,B000G6RYNE,"The plush animal in itself is very nice and well processed, cuddly and neutral in the smell. The technique consists of a block of hard plastic in which everything is installed. Personally, I find that the device is not soft enough embedded in the stuffed animal. So you notice the hard one very clearly. But my wife finds it great, especially to bring our 6 weeks young daughter to sleep.",Flipcart,5,01-12-22,,1
180,B000G6RYNE,The small slumber otter is really sweet.. It is very quiet about the noise setting (the motor for the belly movement) and the music can also be controlled well in the volume.. The shell on the belly is also provided with light which can also be switched off... I am very happy also with the processing... Very soft fabric.. It could be slightly more fed but with some fabric in addition inside it is also solved.. The ECU inside is a little big but very easy made understand.. Very soft keystroke no clapping.. Would I recommend it because it simulates also heart tone and blood flow sounds like in the womb which certainly seems very soothing... So then make yourself a picture of it.. 9 out of 10 points which someone needs a classification... ,Amazon,4,19-10-20,,1
181,B000G6RYNE,"We are super satisfied with the otter. Not only does it look cute, but the noises also come very well with my little one. The light is not too bright and the breath movement is even, even though it is not very natural. However, we only use the sounds because my little one doesn't care about the other functions. Nevertheless, I find that the otter has earned five stars. The volume can be easily adjusted that it is not too loud. If you are looking for a nice gift no matter whether girl or young, I am sure that it always comes well.",Flipcart,5,12-02-21,,1
182,B000G6RYNE,"In itself I find the otter great, unfortunately we had already for the second time a model, which after a few weeks is defective. The button on the belly for automatic on and off was both times suddenly defective and does not work anymore. The different sounds, songs, the light and also the optics are very nice and soothing and our daughter has become so accustomed to falling asleep with the little (and I also ) that we will now probably or badly order one for the third time and hope that this will last longer this time!!!",Amazon,2,01-02-21,1,1
183,B000G6RYNE,"Very cuddly and important noise options available.Moving the visit combined with the light is already very reassuring.In addition, breathe in and out as a noise option.Unfortunately only find the engine a little too loud, but that's my perception, my little one doesn't realize it anyway and he likes it. As a gift for newborns I find it more than suitable!",Facebook,4,09-11-20,,0
184,B000G6RYNE,"This otter convinced even my very sceptical husband immediately! He helped my daughter straight away. The otter was a very strong recommendation from my friend, who uses it with her son and he immediately falls asleep. But it not only helps my baby to fall asleep but even calms me down. It is always 30 minutes. First the abdominal movement goes out after 10 minutes and then after another 10 minutes the pleasant light, followed after another 10 minutes of the set noise.Real class!!! We would buy it again and again and give it to fresh parents!!!",Twitter,5,16-01-21,,1
185,B000G6RYNE,"Super invention, my son ( 3 months old) sleeps much faster and better and the otter is also taken to cuddle. Can I really recommend if the child has problems with falling asleep. Does so even with my daughter(4 years) which sometimes has real difficulties falling asleep. So is also something for older children. Conclusion I would buy it again every time and is also a great gift for freshly baked parents. Also suitable for fruits because there is the function where you can only turn on the heartbeat is then almost like in Mama's belly.",Amazon,5,18-08-20,1,1
186,B000G6RYNE,"I was skeptical at first, but the otter is now part of our sleep routine.We exhibited the breathing but the rest is just great!The somewhat clumsy body doesn't bother us, since the otter (until now) does not serve as a cuddle.",Instagram,5,28-12-20,1,1
187,B000G6RYNE,"The otter is at first glance very sweet, BUT the electronic part is totally thick and noticeable, so that the otter is hardly suitable for cuddles. Besides, after 6 weeks the electronics broke directly with us, nothing could be played off! A cheekyness for such a nameable manufacturer, because this happened not only with this otter, but even with the reordering!!",Flipcart,1,22-10-20,,1
188,B000G6RYNE,Our twins Dear Emmet (as we have baptized him) The only thing I have to complain about is that you can't hire him to play longer. After 30 minutes the music is off. I would have wished that you could decide for yourself because if the babies are restless I would need 1h or 1 1/2h. So I have to get up and go on again. Otherwise ingenious the part,Amazon,4,12-01-21,,0
189,B000G6RYNE,"The otter is incredibly cute and invites you to cuddle. You can switch between different melodies, snoring, heartbeat and rasping, you can adjust that it makes breathing movements and that its belly glows. A star trigger is there for you to see nowhere, which songs these are and the engine that represents the breathing is relatively loud. Otherwise great",Flipcart,4,23-06-20,,1
191,B000G6RYNE,"Not only does this slumber otter look very neat, it also has great settings to support the baby's sleep.With its various settings you can let yourself be soaked by the soft sounds, follow the heartbeat and breath sounds or just turn on a small light when baby is afraid in the dark.He is firmly anchored in bed and is one of our evening and sleep rituals.",Amazon,5,15-02-21,,1
193,B000G6RYNE,"I bought this sleeping aid from Fisher Price, because we also have the old version in the form of a penguin (now 8 years old and still works).This otter is really sweet. He has a very good choice of music. My son (3 years old) doesn't want to fall asleep without him anymore. Even the movements of the belly are quiet and with the turn on of the light children no longer have any fear in the dark.A second otter was already worried for my niece, because the enthusiasm of the parents is also great.",Facebook,5,16-09-20,,1
196,B000G6RYNE,"My niece (1 year) loves the slumber otter. He goes to bed with her and sometimes she also plays with him alone. She can turn him on and off herself. I gave him to her because she often got very quenchy at lunchtime. With ""Otti"" this works better now. You can adjust different melodies and sounds. His belly lifts and lowers. I give him more often because he is not only sweet, but really helps to fall asleep and so relieves everyone a little bit and he always gets very good.",Twitter,5,13-12-20,,1
197,B000G6RYNE,"Great and so realistic with heartbeat, music, breathing and light! Volume can be regulated and by pressing on the belly can deactivate the set function as well as activate again - this is great! You just have to love it! Unfortunately the breathing function cracks already after a short time, which can be very disturbing when falling asleep! Also it imposes itself more often! But otherwise a real lovable and great stuffed animal!",Instagram,4,01-10-20,,1
198,B001EPPFGO,"Our son is already 1 year old and just as long we use the Otti already during the evening ritual to fall asleep. We like above all the pleasant music, not too intrusive, not too loud or shrill. Simply relaxing to fall asleep. We only use the light for some time, which is also very nice. Not too bright, very warm light which alternately becomes brighter and darker again. All in all a great music box.",Flipcart,5,23-01-21,,1
200,B001EPPFGO,"I am very satisfied with the slumber otter. You can adjust the volume of the music individually & I like the choice of the sleeping songs that it plays. I also like that you can also switch off the abdominal movement. The only drawback is that it is relatively hard. You could have taken better care of the price, that the otter is better padded out. Because you can feel the engine very clearly. That's why there is also the one point deduction.",Amazon,4,14-01-21,,1
202,B001EPPFGO,Would the part buy again and again and find it very well suited as a gift. It plays several melodies and simulates breathing and heart sounds. My little one also often presses the part in sleep and does not want to miss it anymore. The heart also gives off some light so that when she wakes up it is not pitch dark in the room.,Flipcart,5,23-11-20,,1
204,B001EPPFGO,"I can't believe it. Since Paul, the Otter moved in, Mausilein can fall asleep and sleep alone.She was not a ""delete"" child and needed mom or dad to sleep. Either on his arm or next to both. It works completely without us and even the pacifier spits it out before.First of all, ours is so demanding that the otter is meaningless, wrongly thought.I can recommend the otter to anyone.",Amazon,5,05-03-21,1,1
205,B001EPPFGO,Would be a nice sleeping toy if the engine of the belly breathing wasn't constantly defective. I now sent the second one back with defective.Otherwise music and light very nice. But for the price I expect a baby toy to last longer than 2 months. Therefore I can't recommend it.,Facebook,2,30-01-20,1,1
206,B007F96QQQ,"Great gift for future parents. I have already ordered several times for young children with friends and family and was always one of the best gifts and investments.The noise level is fine. The smooth movement of the belly calms the baby and the otter conveys a situation similar to that in the mother's belly. It serves as a sleep aid for babies and calms it at the same time.One of my favorites presents, on the one hand it makes a lot of visuals and on the other hand the functionality is also exciting and highly recommended!",Twitter,5,09-02-21,,0
207,B002HQH04O,"Hello and good evening, We have the Otter now about 2 weeks and I have to say I'm thrilled. The volume is adjustable, it makes music, heart tones and much more. Due to the adjustable volume you can control the noise level. This disturbed me to the normal mobiles arg, because the meanwhile are so loud that you can hardly talk normally. I can not think it away at all. Our small mouse (3 months) sleeps every evening with it and is totally relaxed. The best thing is that you can remove the electrical part from the middle and thus wash the Otter super. Therefore, at any time a recommendation value and I would give it away also every time. I hope I could help with this review. Have fun with the little friend ",Instagram,5,13-02-21,,1
208,B002HQH04O,"The little otter is magical! It imitates sounds from the womb, such as the mother's heartbeat or the noise, like in the amniotic fluid. It also makes breathing sounds and the music is very pleasant and soothing. You can also adjust the volume! A sweet gift!",Flipcart,5,03-12-22,,1
209,B0025Z7CGI,"We bought it as a gift. Visually it is a highlight...very sweet and well processed.The breathing movement and the light on the belly are also great.For me, the sound effects (heartbeat and mother's womb sounds) are too artificial and irritating...The music is also not that what you know about musical clocks but rather psychedelic.",Amazon,3,19-07-20,,1
210,B007SESJWC,"We bought the otter around the Black Friday. Our daughter then got it at Christmas and a month later it was unfortunately defective. We got a new one very quickly however. (For 5 stars) However, in my opinion you have to change the batteries very often, which is why we switched off the breath and the air function. Thus the battery lasts longer.Our daughter likes the otter, however, I find the constant price fluctuations between 35 and 45€ quite questionable... for 45€ I would definitely not have bought the otter.",Flipcart,3,01-03-21,,0
211,B001EPPCNK,"A very nice mobile. She takes this better than the baby phone-like mobile. The music is nice relaxing and sounds great. We haven't tried everything else that way yet. The plush is probably what she likes. I like the extra light, also that it goes out before the music goes out. It was worth the price.",Amazon,5,13-10-20,,0
212,B001EPPCNK,The otter itself is worth its money. Our little one loves it from the first day on. The melodies are soothing and the volume can be adjusted perfectly. Slowly our little one's eyes fall too while he listens and looks dreamy on the small night light on the belly.But also with adults... ;),Facebook,5,08-12-20,,1
214,B002U56JXU,"But tonight, as if he had guessed what to get for Christmas, there was no way to go to sleep. So the Christmas present was preferred and the otter unpacked. I thought it was very good that it could go off right away and not first had to be filled with batteries. Every mom / dad knows it - the baby screams it has to go quickly. The otter arrived at the otter, the little one accepted it very well, of course he found the light very great. It didn't take two minutes and he slept. And small tip on the edge: With dad it also works great! ",Twitter,5,26-11-20,,1
215,B002U56JXU,"Our ""Ottie"" is very popular. It is already taken here over all she wants to sleep with. My mouse sleeps since the quieter. And I can push her away after the good night silently without crying she sleeps with her ""Ottie"" nice on. With us the Ottie ""sniffs"" the function is great because my husband and also I are snoring or breathing in the sleep sound. So I can get up again in the evening. He is very fluffy. Alas, if he could be even more upholstered. Since the ""machine"" is still quite hard when you get it to the head. XD.That the belly moves still as if it really breathes is very soothing. Cheap batteries keep up with full function 2 nights. I find that is a very high power consumption.",Instagram,5,12-01-20,,1
216,B002BCD2OG,"The slumber otter was a gift for my 9 month young nephew :-)It is totally soothing, comes to rest and can fall asleep better through the gentle melodies, even the bigger sister, who also comes to rest faster :-)The otter has already become a sleeping ritual for the two :-)",Flipcart,5,07-09-20,,1
